{
  "catalog_version": 1,
  "standard": "ISO 26262",
  "evidence_basis": "Illustrative, incomplete project-authored mapping example informed by controlled ISO 26262:2018 Parts 1–12 checks. OSQAr mechanical validation does not establish semantic validity, completeness, applicability, compliance, qualification, certification, or safety. No copyrighted standard text is reproduced and controlled PDFs are not redistributed.",
  "entries": [
    {
      "reference_id": "ISO26262-2:2018-C6.4.6",
      "edition": "2018",
      "part": 2,
      "clause": "6.4.6",
      "topic": "planning and coordination of safety activities",
      "reference_kind": "normative_requirement",
      "project_paraphrase": "Use Part 2 Clause 6.4.6 as the controlled-copy-checked location for planning and coordination of safety activities.",
      "applicability": "Activities and work products addressing planning and coordination of safety activities when this locator applies to the item, element, or lifecycle context."
    },
    {
      "reference_id": "ISO26262-2:2018-C6.4.8",
      "edition": "2018",
      "part": 2,
      "clause": "6.4.8",
      "topic": "safety case",
      "reference_kind": "normative_requirement",
      "project_paraphrase": "Use Part 2 Clause 6.4.8 as the controlled-copy-checked location for safety case.",
      "applicability": "Activities and work products addressing safety case when this locator applies to the item, element, or lifecycle context."
    },
    {
      "reference_id": "ISO26262-2:2018-C6.4.9",
      "edition": "2018",
      "part": 2,
      "clause": "6.4.9",
      "topic": "confirmation measures",
      "reference_kind": "normative_requirement",
      "project_paraphrase": "Use Part 2 Clause 6.4.9 as the controlled-copy-checked location for confirmation measures.",
      "applicability": "Activities and work products addressing confirmation measures when this locator applies to the item, element, or lifecycle context."
    },
    {
      "reference_id": "ISO26262-2:2018-C6.4.10",
      "edition": "2018",
      "part": 2,
      "clause": "6.4.10",
      "topic": "confirmation reviews",
      "reference_kind": "normative_requirement",
      "project_paraphrase": "Use Part 2 Clause 6.4.10 as the controlled-copy-checked location for confirmation reviews.",
      "applicability": "Activities and work products addressing confirmation reviews when this locator applies to the item, element, or lifecycle context."
    },
    {
      "reference_id": "ISO26262-2:2018-C6.4.11",
      "edition": "2018",
      "part": 2,
      "clause": "6.4.11",
      "topic": "functional safety audit",
      "reference_kind": "normative_requirement",
      "project_paraphrase": "Use Part 2 Clause 6.4.11 as the controlled-copy-checked location for functional safety audit.",
      "applicability": "Activities and work products addressing functional safety audit when this locator applies to the item, element, or lifecycle context."
    },
    {
      "reference_id": "ISO26262-2:2018-C6.4.12",
      "edition": "2018",
      "part": 2,
      "clause": "6.4.12",
      "topic": "functional safety assessment",
      "reference_kind": "normative_requirement",
      "project_paraphrase": "Use Part 2 Clause 6.4.12 as the controlled-copy-checked location for functional safety assessment.",
      "applicability": "Activities and work products addressing functional safety assessment when this locator applies to the item, element, or lifecycle context."
    },
    {
      "reference_id": "ISO26262-2:2018-C6.4.13",
      "edition": "2018",
      "part": 2,
      "clause": "6.4.13",
      "topic": "release for production",
      "reference_kind": "normative_requirement",
      "project_paraphrase": "Use Part 2 Clause 6.4.13 as the controlled-copy-checked location for release for production.",
      "applicability": "Activities and work products addressing release for production when this locator applies to the item, element, or lifecycle context."
    },
    {
      "reference_id": "ISO26262-3:2018-C6",
      "edition": "2018",
      "part": 3,
      "clause": "6",
      "topic": "hazard analysis and risk assessment",
      "reference_kind": "normative_requirement",
      "project_paraphrase": "Use Part 3 Clause 6 as the controlled-copy-checked location for hazard analysis and risk assessment.",
      "applicability": "Activities and work products addressing hazard analysis and risk assessment when this locator applies to the item, element, or lifecycle context."
    },
    {
      "reference_id": "ISO26262-3:2018-C7",
      "edition": "2018",
      "part": 3,
      "clause": "7",
      "topic": "functional safety concept",
      "reference_kind": "normative_requirement",
      "project_paraphrase": "Use Part 3 Clause 7 as the controlled-copy-checked location for functional safety concept.",
      "applicability": "Activities and work products addressing functional safety concept when this locator applies to the item, element, or lifecycle context."
    },
    {
      "reference_id": "ISO26262-4:2018-C6",
      "edition": "2018",
      "part": 4,
      "clause": "6",
      "topic": "technical safety concept",
      "reference_kind": "normative_requirement",
      "project_paraphrase": "Use Part 4 Clause 6 as the controlled-copy-checked location for technical safety concept.",
      "applicability": "Activities and work products addressing technical safety concept when this locator applies to the item, element, or lifecycle context."
    },
    {
      "reference_id": "ISO26262-4:2018-C6.4.1",
      "edition": "2018",
      "part": 4,
      "clause": "6.4.1",
      "topic": "specification of technical safety requirements",
      "reference_kind": "normative_requirement",
      "project_paraphrase": "Use Part 4 Clause 6.4.1 as the controlled-copy-checked location for specification of technical safety requirements.",
      "applicability": "Activities and work products addressing specification of technical safety requirements when this locator applies to the item, element, or lifecycle context."
    },
    {
      "reference_id": "ISO26262-4:2018-C6.4.2",
      "edition": "2018",
      "part": 4,
      "clause": "6.4.2",
      "topic": "safety mechanisms",
      "reference_kind": "normative_requirement",
      "project_paraphrase": "Use Part 4 Clause 6.4.2 as the controlled-copy-checked location for safety mechanisms.",
      "applicability": "Activities and work products addressing safety mechanisms when this locator applies to the item, element, or lifecycle context."
    },
    {
      "reference_id": "ISO26262-4:2018-C6.4.3",
      "edition": "2018",
      "part": 4,
      "clause": "6.4.3",
      "topic": "system architectural design specification and technical safety concept",
      "reference_kind": "normative_requirement",
      "project_paraphrase": "Use Part 4 Clause 6.4.3 as the controlled-copy-checked location for system architectural design specification and technical safety concept.",
      "applicability": "Activities and work products addressing system architectural design specification and technical safety concept when this locator applies to the item, element, or lifecycle context."
    },
    {
      "reference_id": "ISO26262-4:2018-C6.4.4",
      "edition": "2018",
      "part": 4,
      "clause": "6.4.4",
      "topic": "safety analyses and avoidance of systematic failures",
      "reference_kind": "normative_requirement",
      "project_paraphrase": "Use Part 4 Clause 6.4.4 as the controlled-copy-checked location for safety analyses and avoidance of systematic failures.",
      "applicability": "Activities and work products addressing safety analyses and avoidance of systematic failures when this locator applies to the item, element, or lifecycle context."
    },
    {
      "reference_id": "ISO26262-4:2018-C6.4.5",
      "edition": "2018",
      "part": 4,
      "clause": "6.4.5",
      "topic": "control of random hardware failures during operation",
      "reference_kind": "normative_requirement",
      "project_paraphrase": "Use Part 4 Clause 6.4.5 as the controlled-copy-checked location for control of random hardware failures during operation.",
      "applicability": "Activities and work products addressing control of random hardware failures during operation when this locator applies to the item, element, or lifecycle context."
    },
    {
      "reference_id": "ISO26262-4:2018-C6.4.6",
      "edition": "2018",
      "part": 4,
      "clause": "6.4.6",
      "topic": "allocation to hardware and software",
      "reference_kind": "normative_requirement",
      "project_paraphrase": "Use Part 4 Clause 6.4.6 as the controlled-copy-checked location for allocation to hardware and software.",
      "applicability": "Activities and work products addressing allocation to hardware and software when this locator applies to the item, element, or lifecycle context."
    },
    {
      "reference_id": "ISO26262-4:2018-C6.4.7",
      "edition": "2018",
      "part": 4,
      "clause": "6.4.7",
      "topic": "hardware-software interface specification",
      "reference_kind": "normative_requirement",
      "project_paraphrase": "Use Part 4 Clause 6.4.7 as the controlled-copy-checked location for hardware-software interface specification.",
      "applicability": "Activities and work products addressing hardware-software interface specification when this locator applies to the item, element, or lifecycle context."
    },
    {
      "reference_id": "ISO26262-4:2018-C7",
      "edition": "2018",
      "part": 4,
      "clause": "7",
      "topic": "system and item integration and testing",
      "reference_kind": "normative_requirement",
      "project_paraphrase": "Use Part 4 Clause 7 as the controlled-copy-checked location for system and item integration and testing.",